{
  "matrix_version": "0.1",
  "decision_id": "recovery.stop.001",
  "source_cycle_id": "dti.failure.cycle.003",
  "failure_state": "EXECUTION_FAILED_CONFIRMED",
  "consequence_level": "medium",
  "uncertainty_level": "medium",
  "idempotency_verified": false,
  "operation_reversible": false,
  "rollback_available": false,
  "authority_boundary": false,
  "policy_requires_human": false,
  "escalation_trigger": "NONE",
  "selected_action": "STOP",
  "rationale": "No retry or rollback safety contract is established, so the bounded action stops without further mutation.",
  "evidence_references": ["evidence://failure/terminal-confirmed"]
}
